{
  "schema_version": "1.0",
  "generated_from": "docs/target-product/pages|web + contracts/target/pages-target.json",
  "note": "TP-G1-R2 页面行为测试契约：期望值单源；Actual 仅由 Page Driver 探测，禁止回填 Expected。",
  "pages": [
    {
      "page_id": "PAGE-001",
      "route": "pages/index/index",
      "type": "tab",
      "source_doc": "docs/target-product/pages/PAGE-001_SCAN.md",
      "first_screen": [
        "蓝牙/权限/平台状态（或对应可操作提示）；",
        "扫描控制按钮与状态；",
        "设备列表或对应空态（无结果/筛选空/无权限/不支持四者其一）；",
        "发现总数与筛选数（开始扫描后）。"
      ],
      "information_architecture": [
        "导航区：产品标识 + 蓝牙状态芯片（三态：开/关/检测中）；",
        "平台/权限状态区：平台能力结论 + 权限状态（异常时升级为可操作横幅）；",
        "扫描控制区：状态芯片（待开始/扫描中/已完成/失败）、\"发现 N 台 · 筛选后 M 台\"、开始/停止按钮、失败重试横幅；",
        "Smart HID 历史紧凑区（有历史时）：最近 1 台摘要 + \"查看详情\" + \"全部历史\"入口（形态 DEC-012；**只读入口**——不提供删除/批量管理/TTL/重命名，历史管理唯一归 PAGE-004）；",
        "设备列表区：标题\"附近设备\" + 筛选控件（RSSI 阈值/名称前缀/隐藏无名）+ 列表/空态；",
        "广播详情弹窗（点击设备卡触发，非页面区块）。"
      ],
      "states": [
        {
          "state_id": "STATE-P001-01",
          "name": "平台不支持",
          "entry_condition": "能力探测=BLE 不可用（H5/插件缺失）",
          "visible_sections": [
            "UNSUPPORTED 说明",
            "替代入口"
          ],
          "allowed_operations": [],
          "disabled_operations": [],
          "exit_conditions": [
            "平台变化（罕见）"
          ],
          "expected_data_changes": [],
          "expected_recovery": "平台变化（罕见）",
          "test_ids": [
            "TEST-P-001"
          ]
        },
        {
          "state_id": "STATE-P001-02",
          "name": "蓝牙关闭",
          "entry_condition": "适配器=off",
          "visible_sections": [
            "蓝牙芯片=关",
            "去开启按钮"
          ],
          "allowed_operations": [
            "OP-P001-14"
          ],
          "disabled_operations": [],
          "exit_conditions": [
            "用户开启自动恢复"
          ],
          "expected_data_changes": [
            "状态芯片"
          ],
          "expected_recovery": "重试",
          "test_ids": [
            "TEST-A-004"
          ]
        },
        {
          "state_id": "STATE-P001-03",
          "name": "权限拒绝",
          "entry_condition": "权限=denied/permanent",
          "visible_sections": [
            "权限横幅",
            "重试/去设置"
          ],
          "allowed_operations": [],
          "disabled_operations": [],
          "exit_conditions": [
            "授权成功恢复"
          ],
          "expected_data_changes": [
            "状态芯片"
          ],
          "expected_recovery": "重试",
          "test_ids": [
            "TEST-A-001"
          ]
        },
        {
          "state_id": "STATE-P001-04",
          "name": "待开始",
          "entry_condition": "就绪且未扫描",
          "visible_sections": [
            "空提示\"点击开始扫描\""
          ],
          "allowed_operations": [
            "OP-P001-01"
          ],
          "disabled_operations": [
            "OP-P001-02",
            "OP-P001-03",
            "OP-P001-04",
            "OP-P001-05",
            "OP-P001-06",
            "OP-P001-07",
            "OP-P001-08",
            "OP-P001-09",
            "OP-P001-10",
            "OP-P001-11",
            "OP-P001-13",
            "OP-P001-14"
          ],
          "exit_conditions": [
            "开始扫描"
          ],
          "expected_data_changes": [
            "清列表策略见 DEC-013 附则（新一轮重置）"
          ],
          "expected_recovery": "开始扫描",
          "test_ids": [
            "TEST-P-001"
          ]
        },
        {
          "state_id": "STATE-P001-05",
          "name": "扫描中",
          "entry_condition": "discovery active",
          "visible_sections": [
            "状态芯片",
            "停止按钮",
            "实时列表"
          ],
          "allowed_operations": [
            "OP-P001-02"
          ],
          "disabled_operations": [
            "OP-P001-01",
            "OP-P001-03",
            "OP-P001-04",
            "OP-P001-05",
            "OP-P001-06",
            "OP-P001-07",
            "OP-P001-08",
            "OP-P001-09",
            "OP-P001-10",
            "OP-P001-11",
            "OP-P001-13",
            "OP-P001-14"
          ],
          "exit_conditions": [
            "完成/停止/失败/超时"
          ],
          "expected_data_changes": [
            "列表增量、N/M 实时"
          ],
          "expected_recovery": "完成/停止/失败/超时",
          "test_ids": [
            "TEST-A-005",
            "TEST-E-001"
          ]
        },
        {
          "state_id": "STATE-P001-06",
          "name": "无结果",
          "entry_condition": "轮次完成且 N=0",
          "visible_sections": [
            "空态\"未发现设备\"",
            "建议（换位置/确认设备广播）"
          ],
          "allowed_operations": [],
          "disabled_operations": [],
          "exit_conditions": [
            "新轮次"
          ],
          "expected_data_changes": [],
          "expected_recovery": "新轮次",
          "test_ids": [
            "TEST-P-001",
            "TEST-A-005"
          ]
        },
        {
          "state_id": "STATE-P001-07",
          "name": "筛选无结果",
          "entry_condition": "N>0 且 M=0",
          "visible_sections": [
            "\"筛选后无匹配\"",
            "调整筛选建议"
          ],
          "allowed_operations": [],
          "disabled_operations": [],
          "exit_conditions": [
            "M>0 或清筛选"
          ],
          "expected_data_changes": [
            "M 更新"
          ],
          "expected_recovery": "M>0 或清筛选",
          "test_ids": [
            "TEST-P-001"
          ]
        },
        {
          "state_id": "STATE-P001-08",
          "name": "结果列表",
          "entry_condition": "M>0",
          "visible_sections": [
            "设备卡列表"
          ],
          "allowed_operations": [],
          "disabled_operations": [],
          "exit_conditions": [
            "新轮次/离开"
          ],
          "expected_data_changes": [
            "去重与 RSSI 更新"
          ],
          "expected_recovery": "新轮次/离开",
          "test_ids": [
            "TEST-A-005",
            "TEST-E-001"
          ]
        },
        {
          "state_id": "STATE-P001-09",
          "name": "扫描失败",
          "entry_condition": "startDiscovery 失败",
          "visible_sections": [
            "错误横幅",
            "重试"
          ],
          "allowed_operations": [
            "OP-P001-14"
          ],
          "disabled_operations": [
            "OP-P001-01",
            "OP-P001-02",
            "OP-P001-03",
            "OP-P001-04",
            "OP-P001-05",
            "OP-P001-06",
            "OP-P001-07",
            "OP-P001-08",
            "OP-P001-09",
            "OP-P001-10",
            "OP-P001-11",
            "OP-P001-13"
          ],
          "exit_conditions": [
            "重试成功"
          ],
          "expected_data_changes": [],
          "expected_recovery": "重试成功",
          "test_ids": [
            "TEST-P-001",
            "TEST-E-005"
          ]
        },
        {
          "state_id": "STATE-P001-10",
          "name": "已有连接提示",
          "entry_condition": "Registry 有活动会话",
          "visible_sections": [
            "顶部轻提示\"N 台设备保持连接\"（不阻塞扫描）"
          ],
          "allowed_operations": [],
          "disabled_operations": [],
          "exit_conditions": [
            "会话清空"
          ],
          "expected_data_changes": [
            "计数联动"
          ],
          "expected_recovery": "会话清空",
          "test_ids": [
            "TEST-P-007"
          ]
        }
      ],
      "operations": [
        {
          "operation_id": "OP-P001-01",
          "precondition_state": "STATE-P001-04",
          "control": "开始扫描按钮",
          "visible_when": "状态=待开始/已完成/失败",
          "disabled_when": "权限拒绝、蓝牙关、平台不支持",
          "input_fixture": null,
          "expected_ui": [
            "列表增量出现，状态=扫描中"
          ],
          "expected_runtime_events": [
            "Composable→Store→ScanSession→Runtime.startDiscovery"
          ],
          "expected_device_events": [
            "device_effect_from_call_chain:Composable→Store→ScanSession→Runtime.startDiscovery"
          ],
          "e5_mapping": [
            "TEST-A-005",
            "TEST-E-001"
          ],
          "expected_navigation": null,
          "expected_cleanup": [
            "进入扫描前确保旧会话已停"
          ],
          "failure_variants": [
            {
              "name": "primary_failure",
              "condition": "ERR-SCAN-01 横幅+重试",
              "expected_ui": [
                "ERR-SCAN-01 横幅+重试"
              ],
              "expected_recovery": "ERR-SCAN-01 横幅+重试"
            }
          ],
          "test_ids": [
            "TEST-P-001",
            "TEST-A-005",
            "TEST-E-001"
          ],
          "hardware_dependent": true
        },
        {
          "operation_id": "OP-P001-02",
          "precondition_state": "STATE-P001-05",
          "control": "停止扫描按钮",
          "visible_when": "状态=扫描中",
          "disabled_when": "",
          "input_fixture": null,
          "expected_ui": [
            "状态=已完成，列表保留"
          ],
          "expected_runtime_events": [
            "Store.stopScan(user)"
          ],
          "expected_device_events": [],
          "e5_mapping": [
            "TEST-A-005"
          ],
          "expected_navigation": null,
          "expected_cleanup": [
            "停发现+清计时器"
          ],
          "failure_variants": [
            {
              "name": "primary_failure",
              "condition": "记日志兜底静默",
              "expected_ui": [
                "记日志兜底静默"
              ],
              "expected_recovery": "记日志兜底静默"
            }
          ],
          "test_ids": [
            "TEST-P-001",
            "TEST-A-005"
          ],
          "hardware_dependent": false
        },
        {
          "operation_id": "OP-P001-03",
          "precondition_state": "扫描中达到默认时长（DEC-013）",
          "control": "超时自动停止",
          "visible_when": "扫描中达到默认时长（DEC-013）",
          "disabled_when": "",
          "input_fixture": null,
          "expected_ui": [
            "状态=已完成（视为正常完成）"
          ],